{
  "$schema": "http://json-schema.org/draft-07/schema#",
  "$id": "https://example.org/schemas/agent/instance.ready.schema.json",
  "title": "Agent Instance Ready Payload",
  "type": "object",
  "additionalProperties": false,
  "required": [
    "poolId",
    "instanceId"
  ],
  "properties": {
    "poolId": {
      "type": "string",
      "minLength": 1,
      "description": "Stable identifier of the pool or runner group."
    },
    "poolName": {
      "type": [
        "string",
        "null"
      ],
      "description": "Display name of the pool or runner group."
    },
    "instanceId": {
      "type": "string",
      "minLength": 1,
      "description": "Stable identifier of the ready agent or runner instance."
    },
    "instanceName": {
      "type": [
        "string",
        "null"
      ],
      "description": "Display name or hostname for the instance."
    },
    "warmupDurationMs": {
      "type": [
        "integer",
        "null"
      ],
      "minimum": 0,
      "description": "Optional startup warm-up duration in milliseconds."
    },
    "details": {
      "type": "object",
      "additionalProperties": true,
      "description": "Provider-specific metadata for this lifecycle event, such as registration context or capability flags."
    }
  }
}